{
  "absents": [
    "no configured typecheck command",
    "no configured build command",
    "no e2e harness; the change is a catalog/content removal verified by structural tests, deterministic seven-provider build, goldens and installer lifecycle certification",
    "Codex C2 certification evidence is stale for environmental reasons that predate this branch: the committed report pins codex-cli 0.152.1 while the host now runs 0.164.0; a fresh certification against the rebuilt dist/codex bundle succeeded and differs only in the runtime field; re-pinning is left to the human",
    "the manifest test chain stops at the stale Codex link, so every later link was executed individually: upstream scan, removed-owned-artifacts and SEO/GEO V3 checks passed"
  ],
  "decisions_prises_en_ton_nom": [
    "figma-generate-library kept with its public description byte-identical (router-pilot contract); only its body names the official plugin skill figma:figma-use",
    "figma-generate-library catalog dependency on the removed figma-use dropped; the official Figma plugin provides it",
    "catalog migration report regenerated from migrate_catalog _report() instead of --apply, because --apply copies the legacy .claude mirror over canonical core/",
    "golden distribution updated with --approve-review after confirming the drift only contains removed or modified files",
    "router pilot report regenerated after the figma-generate-library body edit; routes and assertions unchanged",
    "taste-router: GPT/Stitch routing question replaced by an existing-project question; the dial row invented in round 1 was removed",
    "installer not extended: dead links in Gemini/OpenCode/agents mirrors, knowledge/multi-mind leftovers and legacy project-level installs are documented in docs/migrations/v6.1-skill-cleanup.md instead of auto-purged",
    "Codex certification not re-pinned to 0.164.0 without human approval",
    "outside the repo: BMAD prompts in ~/.codex/prompts archived (moved to ~/.codex/archive/bmad-prompts-2026-10-28), untracked generated source-command-wiki skills removed from the checkout"
  ],
  "executions": [
    {
      "command": "bash scripts/lint-shell.sh",
      "exit_code": 0,
      "name": "lint",
      "status": "passed",
      "summary": "20 shell files parsed successfully in rounds 1-3"
    },
    {
      "command": "bash tests/test-install-memory-cli.sh && bash tests/run-python310.sh -m unittest discover -s tests -p 'test_*.py' && bash tests/run-python310.sh -m unittest discover -s .claude/skills/llm-wiki/tests -p 'test_*.py' && bash tests/run-python310.sh scripts/validate_planning_lifecycle.py --root . && bash tests/run-python310.sh tooling/migration/migrate_catalog.py --root . --report docs/compatibility/catalog-migration-v6.1.json && bash tests/run-python310.sh tooling/evals/router_pilot.py --root . --output docs/compatibility/router-pilot-figma-generate-library.json --check && bash tests/run-python310.sh tooling/build/compiler.py check --root . --output dist && bash tests/run-python310.sh tooling/testing/golden_distribution.py --dist-root dist --output docs/compatibility/golden/v6.1-p0-distribution.json --check && bash tests/run-python310.sh tooling/runtime/certify_install_lifecycle.py --root . --output docs/compatibility/install-lifecycle-v6.1.json --check && bash tests/test-behavioral.sh && bash tests/run-python310.sh tooling/runtime/certify_codex_plugin.py --bundle dist/codex --output docs/compatibility/codex-plugin-0.152.0.json --check && bash tests/run-python310.sh tooling/upstream/scan.py --root . --output docs/planning/upstream/aidd-v5.9.0.inventory.json --check && bash tests/test-removed-owned-artifacts.sh && bash tests/test-seo-geo-v3.sh",
      "exit_code": 1,
      "name": "test",
      "status": "failed",
      "summary": "135 repository tests, 273 llm-wiki tests, installer memory suite, planning lifecycle, catalog migration (41 skills, 24 commands), router pilot, deterministic build, golden, lifecycle certification, 8 behavioral cases, upstream scan, removed-owned-artifacts and SEO/GEO V3 passed; only the Codex certification link failed as stale (pre-existing codex-cli upgrade)"
    }
  ],
  "manifest_fingerprint": "97106feeff22a5d8803db5e314061d1bdfd2cda23863236f3bda0eebb9b575dd",
  "opinion": {
    "findings": {
      "confirmed": 9,
      "fixed": 9,
      "refuted": 0,
      "remaining": 0,
      "total": 9
    },
    "lenses": {
      "correctness_security": "PASS after fixes: native /code-review found dangling references and one invented design value; no security surface touched",
      "performance": "PASS: global manifest purge removes exactly the 22 skills and 7 commands; ~1.8k tokens of always-loaded descriptions removed; mirror and project-install gaps documented",
      "readability": "PASS after fixes: counts, attribution, orphaned conditionals and stale taste references corrected in core/ and .claude/",
      "structural_maintainability": "PASS with notes: no new abstraction; follow-ups for a content-scan removal test and a catalog consistency check on hand-maintained risk sets"
    },
    "notes": [
      "P2 orphaned knowledge (review-checklist.md, about 22 testing files, tea-index.csv) after removing code-reviewer and test-runner",
      "P2 test_removed_skills.py checks catalog and paths only; a git ls-files content scan like test_removed_autonomous_surfaces.py would catch dangling references",
      "P2 dead skill symlinks in ~/.gemini, ~/.config/opencode and ~/.agents mirrors are not swept by install.sh",
      "P2 legacy docs/WORKFLOW.md and docs/GUIDE-COMPLET.md still describe removed skills",
      "P3 hard-coded knowledge counts in the install.sh banner; RISK sets in migrate_catalog.py are not checked against the catalog"
    ],
    "registry": [
      {
        "id": "core/skills/figma-generate-library/SKILL.md:correctness:figmause",
        "severity": "P1",
        "status": "fixed",
        "summary": "prerequisite pointed to the removed local figma-use"
      },
      {
        "id": "core/skills/pm-prd/SKILL.md:readability:orphhead",
        "severity": "P1",
        "status": "fixed",
        "summary": "orphaned optional conditional after multi-mind removal"
      },
      {
        "id": ".claude/skills/ATTRIBUTION.md:readability:count4",
        "severity": "P1",
        "status": "fixed",
        "summary": "taste skill count said 5 instead of 4"
      },
      {
        "id": "core/skills/taste-critic/SKILL.md:readability:nineskil",
        "severity": "P1",
        "status": "fixed",
        "summary": "stale 9 taste-skills counts in taste-critic and ui-designer"
      },
      {
        "id": "core/skills/taste-router/SKILL.md:correctness:dialrow0",
        "severity": "P1",
        "status": "fixed",
        "summary": "invented dial values for a replaced row"
      },
      {
        "id": "docs/migrations/v6.1-skill-cleanup.md:performance:projpurg",
        "severity": "P1",
        "status": "fixed",
        "summary": "migration doc overstated automatic cleanup; limits now documented"
      },
      {
        "id": "core/skills/pm-prd/SKILL.md:correctness:mbutton0",
        "severity": "P2",
        "status": "fixed",
        "summary": "[M] Multi-Mind option at a STOP checkpoint"
      },
      {
        "id": ".claude/examples/README.md:readability:refdocs0",
        "severity": "P3",
        "status": "fixed",
        "summary": "examples and verification matrix advertised /docs and /refactor"
      },
      {
        "id": "core/commands/pr-review.md:readability:brutal00",
        "severity": "P3",
        "status": "fixed",
        "summary": "pr-review listed the removed brutalist style"
      }
    ],
    "rounds": [
      {
        "fixed_confirmed_p0_p1": 6,
        "new_confirmed_p0_p1": 6,
        "round": 1
      },
      {
        "new_confirmed_p0_p1": 0,
        "round": 2
      },
      {
        "new_confirmed_p0_p1": 0,
        "round": 3
      }
    ]
  },
  "schema_version": 1
}
